{
  "schema_version": 1,
  "id": "gloomwing-hunt",
  "metadata": {
    "source": "Original NeathBound adaptation of user-provided Gloomwing outline, avoiding Fallen London text.",
    "chapter_count": 30,
    "created_on": "2026-10-15",
    "stat_map": {
      "Observation": "insight",
      "Resolve": "nerve",
      "Guile": "shadow",
      "Persuasion": "poise"
    },
    "menace_map": {
      "delirium": "dread",
      "notoriety": "scandal"
    }
  },
  "locations": {
    "duskwater": {
      "name": "Duskwater",
      "region": "The Lower City",
      "subtitle": "Where missing hunters leave their boots on doorsteps.",
      "atmosphere": "Cold fog and the smell of rain that has forgotten the sky.",
      "stories": [
        "gloomwing_hunt_01",
        "gloomwing_hunt_02",
        "gloomwing_hunt_03",
        "gloomwing_hunt_04",
        "gloomwing_hunt_05",
        "gloomwing_hunt_06",
        "gloomwing_hunt_07",
        "gloomwing_hunt_08",
        "gloomwing_hunt_09"
      ]
    },
    "black-spire": {
      "name": "The Black Spire",
      "region": "Beyond Duskwater",
      "subtitle": "A tower whose steps remember every oath.",
      "atmosphere": "Old paper, bare stone and the beat of wings too tired to fly.",
      "stories": [
        "gloomwing_hunt_10",
        "gloomwing_hunt_11",
        "gloomwing_hunt_12",
        "gloomwing_hunt_13",
        "gloomwing_hunt_14",
        "gloomwing_hunt_15",
        "gloomwing_hunt_16",
        "gloomwing_hunt_17",
        "gloomwing_hunt_18",
        "gloomwing_hunt_19"
      ]
    },
    "bureau-hall": {
      "name": "Bureau of Threat Abatement",
      "region": "The Civic Depths",
      "subtitle": "Where the city writes its monsters into existence.",
      "atmosphere": "Damp forms, tired clerks and lanterns polished to hide their smoke.",
      "stories": [
        "gloomwing_hunt_20",
        "gloomwing_hunt_21",
        "gloomwing_hunt_22",
        "gloomwing_hunt_23",
        "gloomwing_hunt_24",
        "gloomwing_hunt_25",
        "gloomwing_hunt_26",
        "gloomwing_hunt_27",
        "gloomwing_hunt_28",
        "gloomwing_hunt_29"
      ]
    }
  },
  "items": {
    "bureau-dossier": {
      "name": "Bureau Dossier",
      "description": "A physical reminder of chapter 1 of the Gloomwing hunt.",
      "category": "curiosity"
    },
    "spire-map": {
      "name": "Spire Map",
      "description": "A physical reminder of chapter 2 of the Gloomwing hunt.",
      "category": "curiosity"
    },
    "collector-feather": {
      "name": "Collector Feather",
      "description": "A physical reminder of chapter 3 of the Gloomwing hunt.",
      "category": "curiosity"
    },
    "archivist-lens": {
      "name": "Archivist Lens",
      "description": "A physical reminder of chapter 4 of the Gloomwing hunt.",
      "category": "curiosity"
    },
    "trace-slate": {
      "name": "Trace Slate",
      "description": "A physical reminder of chapter 5 of the Gloomwing hunt.",
      "category": "curiosity"
    },
    "collector-claw": {
      "name": "Collector Claw",
      "description": "A physical reminder of chapter 6 of the Gloomwing hunt.",
      "category": "curiosity"
    },
    "wound-silver": {
      "name": "Wound Silver",
      "description": "A physical reminder of chapter 7 of the Gloomwing hunt.",
      "category": "curiosity"
    },
    "bureau-orders": {
      "name": "Bureau Orders",
      "description": "A physical reminder of chapter 8 of the Gloomwing hunt.",
      "category": "curiosity"
    },
    "gloomwing-scale": {
      "name": "Gloomwing Scale",
      "description": "A physical reminder of chapter 9 of the Gloomwing hunt.",
      "category": "curiosity"
    },
    "ancient-key": {
      "name": "Ancient Key",
      "description": "A physical reminder of chapter 10 of the Gloomwing hunt.",
      "category": "curiosity"
    },
    "shadow-scrap": {
      "name": "Shadow Scrap",
      "description": "A physical reminder of chapter 11 of the Gloomwing hunt.",
      "category": "curiosity"
    },
    "debt-token": {
      "name": "Debt Token",
      "description": "A physical reminder of chapter 12 of the Gloomwing hunt.",
      "category": "curiosity"
    },
    "stolen-ledger": {
      "name": "Stolen Ledger",
      "description": "A physical reminder of chapter 13 of the Gloomwing hunt.",
      "category": "curiosity"
    },
    "moth-king-sigil": {
      "name": "Moth King Sigil",
      "description": "A physical reminder of chapter 14 of the Gloomwing hunt.",
      "category": "curiosity"
    },
    "paper-throne-splinter": {
      "name": "Paper Throne Splinter",
      "description": "A physical reminder of chapter 15 of the Gloomwing hunt.",
      "category": "curiosity"
    },
    "sealed-envelope": {
      "name": "Sealed Envelope",
      "description": "A physical reminder of chapter 16 of the Gloomwing hunt.",
      "category": "curiosity"
    },
    "returned-letter": {
      "name": "Returned Letter",
      "description": "A physical reminder of chapter 17 of the Gloomwing hunt.",
      "category": "curiosity"
    },
    "bureau-seal": {
      "name": "Bureau Seal",
      "description": "A physical reminder of chapter 18 of the Gloomwing hunt.",
      "category": "curiosity"
    },
    "collector-whistle": {
      "name": "Collector Whistle",
      "description": "A physical reminder of chapter 19 of the Gloomwing hunt.",
      "category": "curiosity"
    },
    "ledger-of-names": {
      "name": "Ledger Of Names",
      "description": "A physical reminder of chapter 20 of the Gloomwing hunt.",
      "category": "curiosity"
    },
    "rebel-warrant": {
      "name": "Rebel Warrant",
      "description": "A physical reminder of chapter 21 of the Gloomwing hunt.",
      "category": "curiosity"
    },
    "paper-oath": {
      "name": "Paper Oath",
      "description": "A physical reminder of chapter 22 of the Gloomwing hunt.",
      "category": "curiosity"
    },
    "name-receipt": {
      "name": "Name Receipt",
      "description": "A physical reminder of chapter 23 of the Gloomwing hunt.",
      "category": "curiosity"
    },
    "guardian-testimony": {
      "name": "Guardian Testimony",
      "description": "A physical reminder of chapter 24 of the Gloomwing hunt.",
      "category": "curiosity"
    },
    "bureau-evidence": {
      "name": "Bureau Evidence",
      "description": "A physical reminder of chapter 25 of the Gloomwing hunt.",
      "category": "curiosity"
    },
    "first-commission": {
      "name": "First Commission",
      "description": "A physical reminder of chapter 26 of the Gloomwing hunt.",
      "category": "curiosity"
    },
    "spire-shard": {
      "name": "Spire Shard",
      "description": "A physical reminder of chapter 27 of the Gloomwing hunt.",
      "category": "curiosity"
    },
    "new-charter": {
      "name": "New Charter",
      "description": "A physical reminder of chapter 28 of the Gloomwing hunt.",
      "category": "curiosity"
    },
    "gloomwing-heir": {
      "name": "Young Gloomwing",
      "description": "A guarded life entrusted to your care; it does not yet know the songs of the old Spire.",
      "category": "companion",
      "slot": "companion",
      "stats": {
        "insight": 2,
        "poise": 1
      }
    },
    "gloomwing-treasure-scale": {
      "name": "Scale of the Last Guardian",
      "category": "curiosity",
      "slot": "treasure",
      "stats": {
        "insight": 2,
        "nerve": 1,
        "dreaded": 1
      },
      "description": "Proof that you defended a creature the Bureau wanted forgotten."
    },
    "gloomwing-treasure-claw": {
      "name": "Claw of the Unsealed Spire",
      "category": "curiosity",
      "slot": "treasure",
      "stats": {
        "nerve": 2,
        "insight": 1,
        "bizarre": 1
      },
      "description": "A costly victory, and a reminder of what the city lost."
    },
    "gloomwing-treasure-treaty": {
      "name": "Treaty Under Black Wings",
      "category": "curiosity",
      "slot": "treasure",
      "stats": {
        "poise": 2,
        "insight": 1,
        "respectable": 1
      },
      "description": "A public covenant with signatures from enemies who once denied one another's names."
    }
  },
  "stories": {
    "gloomwing_hunt_00": {
      "title": "1/30: The Commissioner's Black Ledger",
      "kicker": "The Hunt for the Gloomwing · personal ambition",
      "pattern": "chain",
      "ambition_id": "gloomwing-hunt",
      "requires_progress": {
        "id": "gloomwing-hunt",
        "value": 0
      },
      "sets_progress": {
        "id": "gloomwing-hunt",
        "value": 1
      },
      "once": true,
      "text": "The Bureau offers four million Lumens for a creature nobody can describe consistently. A clerk presents three contracts, each already signed in handwriting distressingly like yours.",
      "requirements": [],
      "choices": [
        {
          "id": "investigate",
          "label": "Read the casualty register",
          "challenge": {
            "quality": "insight",
            "difficulty": 3,
            "scaler": 0.6,
            "mode": "broad",
            "rareChance": 0.04
          },
          "success": "A survey of the claimants reveals that each vanished after hearing the same bell. You set a fact down where another person may find it.",
          "failure": "The evidence twists away before you can secure it. The hunt has not advanced; you can try another approach.",
          "successEffects": [
            {
              "type": "ambition-progress",
              "id": "gloomwing-hunt",
              "amount": 1
            },
            {
              "type": "flag",
              "id": "gloomwing-choice-00-0",
              "value": true
            },
            {
              "type": "unlock-location",
              "id": "duskwater"
            },
            {
              "type": "location",
              "id": "duskwater"